wandb: Using wandb-core as the SDK backend.  Please refer to https://wandb.me/wandb-core for more information.
wandb: Currently logged in as: manurslf (manurslf301) to https://api.wandb.ai. Use `wandb login --relogin` to force relogin
wandb: Tracking run with wandb version 0.19.8
wandb: Run data is saved locally in /home/users/r/rasolof2/BCs_emmanuelrasolofo/BCs_EmmanuelRasolofo/wandb/run-20250315_115114-lgp64bqk
wandb: Run `wandb offline` to turn off syncing.
wandb: Syncing run DS midjourney dataset - AT 2 (20250315-115114)
wandb: ⭐️ View project at https://wandb.ai/manurslf301/Encoder-DecoderProject
wandb: 🚀 View run at https://wandb.ai/manurslf301/Encoder-DecoderProject/runs/lgp64bqk
Operation on cuda
Using midjourney DATASET, Classes in dataset: ['ai', 'nature']
Additional tokens : 2
Training...
Loss epoch 0 -> 1.21921
Loss epoch 1 -> 0.31633
Loss epoch 2 -> 0.10603
Loss epoch 3 -> 0.02483
Loss epoch 4 -> 0.02177
Loss epoch 5 -> 0.00849
Loss epoch 6 -> 0.00164
Loss epoch 7 -> 0.00083
Loss epoch 8 -> 0.00016
Loss epoch 9 -> 0.00003
Loss epoch 10 -> 0.00002
Loss epoch 11 -> 0.00002
Loss epoch 12 -> 0.00001
Loss epoch 13 -> 0.00001
Loss epoch 14 -> 0.00001
Loss epoch 15 -> 0.00001
Loss epoch 16 -> 0.00001
Loss epoch 17 -> 0.00001
Loss epoch 18 -> 0.00001
Loss epoch 19 -> 0.00001
Loss epoch 20 -> 0.00001
Loss epoch 21 -> 0.00001
Loss epoch 22 -> 0.00001
Loss epoch 23 -> 0.00001
Loss epoch 24 -> 0.00001
Loss epoch 25 -> 0.00001
Loss epoch 26 -> 0.00001
Loss epoch 27 -> 0.00001
Loss epoch 28 -> 0.00001
Loss epoch 29 -> 0.00001
Loss epoch 30 -> 0.00001
Loss epoch 31 -> 0.00001
Loss epoch 32 -> 0.00001
Loss epoch 33 -> 0.00001
Loss epoch 34 -> 0.00001
Loss epoch 35 -> 0.00001
Loss epoch 36 -> 0.00001
Loss epoch 37 -> 0.00001
Loss epoch 38 -> 0.00001
wandb:                                                                                
wandb: 
wandb: Run history:
wandb: Test/Accuracy ▁▇▇▇██▇▇████████████████████████████████
wandb:    Train/Loss █▃▂▁▁▁▁▁▁▁▁▁▁▁▁▁▁▁▁▁▁▁▁▁▁▁▁▁▁▁▁▁▁▁▁▁▁▁▁▁
wandb:         epoch ▁▁▁▂▂▂▂▂▂▃▃▃▃▃▄▄▄▄▄▄▅▅▅▅▅▅▆▆▆▆▆▇▇▇▇▇▇███
wandb: 
wandb: Run summary:
wandb: Test/Accuracy 0.909
wandb:    Train/Loss 1e-05
wandb:         epoch 39
wandb: 
wandb: 🚀 View run DS midjourney dataset - AT 2 (20250315-115114) at: https://wandb.ai/manurslf301/Encoder-DecoderProject/runs/lgp64bqk
wandb: ⭐️ View project at: https://wandb.ai/manurslf301/Encoder-DecoderProject
wandb: Synced 5 W&B file(s), 0 media file(s), 0 artifact file(s) and 0 other file(s)
wandb: Find logs at: ./wandb/run-20250315_115114-lgp64bqk/logs
wandb: Tracking run with wandb version 0.19.8
wandb: Run data is saved locally in /home/users/r/rasolof2/BCs_emmanuelrasolofo/BCs_EmmanuelRasolofo/wandb/run-20250315_123341-eldsiv1s
wandb: Run `wandb offline` to turn off syncing.
wandb: Syncing run DS midjourney dataset - AT 3 (20250315-115114)
wandb: ⭐️ View project at https://wandb.ai/manurslf301/Encoder-DecoderProject
wandb: 🚀 View run at https://wandb.ai/manurslf301/Encoder-DecoderProject/runs/eldsiv1s
Loss epoch 39 -> 0.00001
end...
Accuracy : 0.909
Classification report:
              precision    recall  f1-score   support

          ia       0.90      0.92      0.91       500
      nature       0.92      0.90      0.91       500

    accuracy                           0.91      1000
   macro avg       0.91      0.91      0.91      1000
weighted avg       0.91      0.91      0.91      1000

-----------------------------------------------------------------------------------------------------------
Additional tokens : 3
Training...
Loss epoch 0 -> 1.14817
Loss epoch 1 -> 0.31815
Loss epoch 2 -> 0.12396
Loss epoch 3 -> 0.03026
Loss epoch 4 -> 0.00816
Loss epoch 5 -> 0.00692
Loss epoch 6 -> 0.00279
Loss epoch 7 -> 0.00387
Loss epoch 8 -> 0.01126
Loss epoch 9 -> 0.01554
Loss epoch 10 -> 0.00995
Loss epoch 11 -> 0.00211
Loss epoch 12 -> 0.00056
Loss epoch 13 -> 0.00008
Loss epoch 14 -> 0.00004
Loss epoch 15 -> 0.00003
Loss epoch 16 -> 0.00002
Loss epoch 17 -> 0.00002
Loss epoch 18 -> 0.00002
Loss epoch 19 -> 0.00002
Loss epoch 20 -> 0.00002
Loss epoch 21 -> 0.00001
Loss epoch 22 -> 0.00001
Loss epoch 23 -> 0.00001
Loss epoch 24 -> 0.00001
Loss epoch 25 -> 0.00001
Loss epoch 26 -> 0.00001
Loss epoch 27 -> 0.00001
Loss epoch 28 -> 0.00001
Loss epoch 29 -> 0.00001
Loss epoch 30 -> 0.00001
Loss epoch 31 -> 0.00001
Loss epoch 32 -> 0.00001
Loss epoch 33 -> 0.00001
Loss epoch 34 -> 0.00001
Loss epoch 35 -> 0.00001
Loss epoch 36 -> 0.00001
Loss epoch 37 -> 0.00001
Loss epoch 38 -> 0.00001
wandb:                                                                                
wandb: 
wandb: Run history:
wandb: Test/Accuracy ▁▇▇██▇▇█▇▇██████████████████████████████
wandb:    Train/Loss █▃▂▁▁▁▁▁▁▁▁▁▁▁▁▁▁▁▁▁▁▁▁▁▁▁▁▁▁▁▁▁▁▁▁▁▁▁▁▁
wandb:         epoch ▁▁▁▂▂▂▂▂▂▃▃▃▃▃▄▄▄▄▄▄▅▅▅▅▅▅▆▆▆▆▆▇▇▇▇▇▇███
wandb: 
wandb: Run summary:
wandb: Test/Accuracy 0.911
wandb:    Train/Loss 1e-05
wandb:         epoch 39
wandb: 
wandb: 🚀 View run DS midjourney dataset - AT 3 (20250315-115114) at: https://wandb.ai/manurslf301/Encoder-DecoderProject/runs/eldsiv1s
wandb: ⭐️ View project at: https://wandb.ai/manurslf301/Encoder-DecoderProject
wandb: Synced 5 W&B file(s), 0 media file(s), 0 artifact file(s) and 0 other file(s)
wandb: Find logs at: ./wandb/run-20250315_123341-eldsiv1s/logs
wandb: Tracking run with wandb version 0.19.8
wandb: Run data is saved locally in /home/users/r/rasolof2/BCs_emmanuelrasolofo/BCs_EmmanuelRasolofo/wandb/run-20250315_131601-4g2wlc7o
wandb: Run `wandb offline` to turn off syncing.
wandb: Syncing run DS midjourney dataset - AT 4 (20250315-115114)
wandb: ⭐️ View project at https://wandb.ai/manurslf301/Encoder-DecoderProject
wandb: 🚀 View run at https://wandb.ai/manurslf301/Encoder-DecoderProject/runs/4g2wlc7o
Loss epoch 39 -> 0.00001
end...
Accuracy : 0.911
Classification report:
              precision    recall  f1-score   support

          ia       0.91      0.92      0.91       500
      nature       0.92      0.91      0.91       500

    accuracy                           0.91      1000
   macro avg       0.91      0.91      0.91      1000
weighted avg       0.91      0.91      0.91      1000

-----------------------------------------------------------------------------------------------------------
Additional tokens : 4
Training...
Loss epoch 0 -> 1.14115
Loss epoch 1 -> 0.32316
Loss epoch 2 -> 0.12463
Loss epoch 3 -> 0.02819
Loss epoch 4 -> 0.02515
Loss epoch 5 -> 0.02081
Loss epoch 6 -> 0.00516
Loss epoch 7 -> 0.00139
Loss epoch 8 -> 0.00010
Loss epoch 9 -> 0.00004
Loss epoch 10 -> 0.00003
Loss epoch 11 -> 0.00002
Loss epoch 12 -> 0.00002
Loss epoch 13 -> 0.00002
Loss epoch 14 -> 0.00002
Loss epoch 15 -> 0.00002
Loss epoch 16 -> 0.00001
Loss epoch 17 -> 0.00001
Loss epoch 18 -> 0.00001
Loss epoch 19 -> 0.00001
Loss epoch 20 -> 0.00001
Loss epoch 21 -> 0.00001
Loss epoch 22 -> 0.00001
Loss epoch 23 -> 0.00001
Loss epoch 24 -> 0.00001
Loss epoch 25 -> 0.00001
Loss epoch 26 -> 0.00001
Loss epoch 27 -> 0.00001
Loss epoch 28 -> 0.00001
Loss epoch 29 -> 0.00001
Loss epoch 30 -> 0.00001
Loss epoch 31 -> 0.00001
Loss epoch 32 -> 0.00001
Loss epoch 33 -> 0.00001
Loss epoch 34 -> 0.00001
Loss epoch 35 -> 0.00001
Loss epoch 36 -> 0.00001
Loss epoch 37 -> 0.00001
Loss epoch 38 -> 0.00001
wandb:                                                                                
wandb: 
wandb: Run history:
wandb: Test/Accuracy ▁▇███▇██████████████████████████████████
wandb:    Train/Loss █▃▂▁▁▁▁▁▁▁▁▁▁▁▁▁▁▁▁▁▁▁▁▁▁▁▁▁▁▁▁▁▁▁▁▁▁▁▁▁
wandb:         epoch ▁▁▁▂▂▂▂▂▂▃▃▃▃▃▄▄▄▄▄▄▅▅▅▅▅▅▆▆▆▆▆▇▇▇▇▇▇███
wandb: 
wandb: Run summary:
wandb: Test/Accuracy 0.909
wandb:    Train/Loss 1e-05
wandb:         epoch 39
wandb: 
wandb: 🚀 View run DS midjourney dataset - AT 4 (20250315-115114) at: https://wandb.ai/manurslf301/Encoder-DecoderProject/runs/4g2wlc7o
wandb: ⭐️ View project at: https://wandb.ai/manurslf301/Encoder-DecoderProject
wandb: Synced 5 W&B file(s), 0 media file(s), 0 artifact file(s) and 0 other file(s)
wandb: Find logs at: ./wandb/run-20250315_131601-4g2wlc7o/logs
wandb: Tracking run with wandb version 0.19.8
wandb: Run data is saved locally in /home/users/r/rasolof2/BCs_emmanuelrasolofo/BCs_EmmanuelRasolofo/wandb/run-20250315_135825-30f7w17w
wandb: Run `wandb offline` to turn off syncing.
wandb: Syncing run DS midjourney dataset - AT 5 (20250315-115114)
wandb: ⭐️ View project at https://wandb.ai/manurslf301/Encoder-DecoderProject
wandb: 🚀 View run at https://wandb.ai/manurslf301/Encoder-DecoderProject/runs/30f7w17w
Loss epoch 39 -> 0.00001
end...
Accuracy : 0.909
Classification report:
              precision    recall  f1-score   support

          ia       0.91      0.90      0.91       500
      nature       0.90      0.92      0.91       500

    accuracy                           0.91      1000
   macro avg       0.91      0.91      0.91      1000
weighted avg       0.91      0.91      0.91      1000

-----------------------------------------------------------------------------------------------------------
Additional tokens : 5
Training...
Loss epoch 0 -> 1.15907
Loss epoch 1 -> 0.31251
Loss epoch 2 -> 0.11504
Loss epoch 3 -> 0.01899
Loss epoch 4 -> 0.00775
Loss epoch 5 -> 0.01054
Loss epoch 6 -> 0.01134
Loss epoch 7 -> 0.01058
Loss epoch 8 -> 0.00907
Loss epoch 9 -> 0.00454
Loss epoch 10 -> 0.00987
Loss epoch 11 -> 0.01508
Loss epoch 12 -> 0.00205
Loss epoch 13 -> 0.00012
Loss epoch 14 -> 0.00004
Loss epoch 15 -> 0.00003
Loss epoch 16 -> 0.00002
Loss epoch 17 -> 0.00002
Loss epoch 18 -> 0.00002
Loss epoch 19 -> 0.00002
Loss epoch 20 -> 0.00002
Loss epoch 21 -> 0.00001
Loss epoch 22 -> 0.00001
Loss epoch 23 -> 0.00001
Loss epoch 24 -> 0.00001
Loss epoch 25 -> 0.00001
Loss epoch 26 -> 0.00001
Loss epoch 27 -> 0.00001
Loss epoch 28 -> 0.00001
Loss epoch 29 -> 0.00001
Loss epoch 30 -> 0.00001
Loss epoch 31 -> 0.00001
Loss epoch 32 -> 0.00001
Loss epoch 33 -> 0.00001
Loss epoch 34 -> 0.00001
srun: Job step aborted: Waiting up to 92 seconds for job step to finish.
slurmstepd: error: *** JOB 289243 ON gpu002 CANCELLED AT 2025-03-15T14:35:56 ***
slurmstepd: error: *** STEP 289243.0 ON gpu002 CANCELLED AT 2025-03-15T14:35:56 ***
